{
  "$schema": "https://json-schema.org/draft/2020-12/schema",
  "title": "shepherd config",
  "description": "Stage, model, oracle, and loop-limit settings for shepherd runs.",
  "type": "object",
  "additionalProperties": false,
  "required": ["stages"],
  "properties": {
    "stages": {
      "description": "Engine and model assignments for each shepherd stage. Single stages (verify, architect, implementer, success_criteria, fulfillment) are optional: when absent, the built-in role table drives the stage without an engine.",
      "type": "object",
      "additionalProperties": false,
      "required": ["reviewers", "final_reviewers"],
      "properties": {
        "verify":      { "$ref": "#/$defs/singleStageValue" },
        "architect":   { "$ref": "#/$defs/singleStageValue" },
        "implementer": { "$ref": "#/$defs/singleStageValue" },
        "success_criteria": { "$ref": "#/$defs/singleStageValue" },
        "fulfillment": { "$ref": "#/$defs/singleStageValue" },
        "reviewers":       { "description": "Roster for inner-loop reviewers. The design gate selects a per-run subset.", "type": "array", "items": { "$ref": "#/$defs/stageValue" }, "minItems": 1 },
        "final_reviewers": { "description": "Roster for post-convergence reviewers. May be empty.", "type": "array", "items": { "$ref": "#/$defs/stageValue" }, "minItems": 0 }
      }
    },
    "oracle": {
      "description": "Deterministic checks that must pass before reviewers can approve.",
      "type": "object",
      "additionalProperties": false,
      "properties": {
        "commands": {
          "description": "Finite, non-mutating shell commands such as type checks, lint checks, builds, and targeted tests.",
          "type": "array",
          "items": { "type": "string", "minLength": 1 },
          "uniqueItems": true
        }
      }
    },
    "limits": {
      "description": "Default loop bounds before the design gate chooses run-specific limits.",
      "type": "object",
      "additionalProperties": false,
      "properties": {
        "inner_iterations":    { "description": "Maximum regular implement/review iterations.", "type": "integer", "minimum": 1 },
        "final_review_rounds": { "description": "Maximum targeted reopen rounds from final-review findings.", "type": "integer", "minimum": 0 }
      }
    },
    "plan_mode_gate": { "description": "For any agent that has a plan mode (Claude Code, Cursor, Codex, …). When true (default), present the generic design gate through plan mode as an adapter: accepting the plan approves, rejecting or editing it revises; falls back to the chat gate if plan tools error or are unavailable. Set false for agents without a plan mode or for headless runs; the chat + _design.approved gate is the portable mechanism either way.", "type": "boolean" }
  },
  "$defs": {
    "stageValue": {
      "description": "One reviewer assignment. `use` names a registry entry; `model` is optional.",
      "type": "object",
      "additionalProperties": false,
      "required": ["use"],
      "properties": {
        "use":   { "description": "Registry `use` name for the engine that fills this stage.", "type": "string" },
        "model": { "description": "Model for this stage: a model name (opus, sonnet, haiku) or \"auto\" to let the orchestrator pick per role and complexity.", "type": "string" }
      }
    },
    "singleStageValue": {
      "description": "One single-stage assignment. At least one of `use` (engine) or `model`. Model-only means the built-in role behavior on the given model.",
      "type": "object",
      "additionalProperties": false,
      "minProperties": 1,
      "properties": {
        "use":   { "description": "Registry `use` name for the engine that fills this stage.", "type": "string" },
        "model": { "description": "Model for this stage: a model name (opus, sonnet, haiku) or \"auto\" to let the orchestrator pick per role and complexity.", "type": "string" }
      }
    }
  }
}
