{
  "stages": {
    "reviewers": [
      { "use": "staff-review",  "model": "auto" }
    ],
    "final_reviewers": [
      { "use": "thermonuclear",   "model": "auto" },
      { "use": "ponytail-review", "model": "sonnet" }
    ]
  },
  "oracle": {
    "commands": []
  },
  "limits": { "inner_iterations": 3, "final_review_rounds": 2 },
  "plan_mode_gate": true
}
